{
  "$schema": "https://json-schema.org/draft/2020-12/schema",
  "title": "workflow-research-pi request",
  "description": "Pi-subagents 0.72.1 envelope: <=16384 UTF-8 JSON bytes total, nonempty strings, <=16 properties/object, <=64 items/array, nesting <=8. Inline evidence <=8192 UTF-8 JSON bytes total; script enforces byte and cross-field constraints. Parent assertions do not prove external facts.",
  "type": "object",
  "properties": {
    "mode": {
      "enum": [
        "pipeline",
        "research-only"
      ],
      "description": "Optional opt-in selector. Omission preserves the legacy pipeline request shape."
    },
    "cwd": {
      "type": "string",
      "minLength": 1,
      "maxLength": 4096,
      "pattern": "^/(?!.*(?:\\\\|//|/\\.\\.?(/|$)))[^\\u0000-\\u001f]*[^/]$"
    },
    "outputDir": {
      "type": "string",
      "minLength": 1,
      "maxLength": 4096,
      "pattern": "^/(?!.*(?:\\\\|//|/\\.\\.?(/|$)))[^\\u0000-\\u001f]*[^/]$"
    },
    "sourceRevision": {
      "type": "string",
      "minLength": 1,
      "maxLength": 200
    },
    "sourceRoots": {
      "type": "array",
      "items": {
        "type": "string",
        "minLength": 1,
        "maxLength": 4096,
        "pattern": "^/(?!.*(?:\\\\|//|/\\.\\.?(/|$)))[^\\u0000-\\u001f]*[^/]$"
      },
      "minItems": 1,
      "maxItems": 16
    },
    "authorization": {
      "type": "object",
      "properties": {
        "parentVerified": {
          "const": true
        },
        "evidence": {
          "type": "string",
          "minLength": 1,
          "maxLength": 8192
        },
        "actions": {
          "type": "array",
          "items": {
            "type": "string",
            "minLength": 1,
            "maxLength": 100
          },
          "minItems": 1,
          "maxItems": 8
        },
        "files": {
          "type": "array",
          "items": {
            "type": "string",
            "minLength": 1,
            "maxLength": 1024,
            "pattern": "^(?!/)(?!.*(?:\\.\\.|\\\\|\\*|\\?|\\[|\\]))[^\\u0000-\\u001f]+$"
          },
          "minItems": 0,
          "maxItems": 64
        }
      },
      "required": [
        "parentVerified",
        "evidence",
        "actions",
        "files"
      ],
      "additionalProperties": false,
      "maxProperties": 16
    },
    "preflight": {
      "type": "object",
      "properties": {
        "pathsVerified": {
          "const": true
        },
        "rolesVerified": {
          "const": true
        },
        "evidence": {
          "type": "string",
          "minLength": 1,
          "maxLength": 8192
        },
        "piVersion": {
          "enum": ["0.87.1", "1.1.0"]
        },
        "subagentsVersion": {
          "const": "0.72.1"
        },
        "snapshotUse": {
          "type": "object",
          "properties": {
            "schemaVersion": { "const": 1 },
            "snapshotId": { "type": "string", "pattern": "^[0-9a-f]{32}$" },
            "path": { "type": "string", "minLength": 1, "maxLength": 4096, "pattern": "^/(?!.*(?:\\\\|//|/\\.\\.?(/|$)))[^\\u0000-\\u001f]*[^/]$" },
            "sha256": { "type": "string", "pattern": "^[0-9a-f]{64}$" },
            "environmentIdentitySha256": { "type": "string", "pattern": "^[0-9a-f]{64}$" },
            "observedAt": { "type": "string", "pattern": "^\\d{4}-\\d{2}-\\d{2}T\\d{2}:\\d{2}:\\d{2}(?:\\.\\d+)?Z$", "maxLength": 100 }
          },
          "required": ["schemaVersion", "snapshotId", "path", "sha256", "environmentIdentitySha256", "observedAt"],
          "additionalProperties": false,
          "maxProperties": 16
        },
        "liveChecks": {
          "type": "object",
          "properties": {
            "checkedAt": { "type": "string", "pattern": "^\\d{4}-\\d{2}-\\d{2}T\\d{2}:\\d{2}:\\d{2}(?:\\.\\d+)?Z$", "maxLength": 100 },
            "authorityEvidenceSha256": { "type": "string", "pattern": "^[0-9a-f]{64}$" },
            "resourceEvidenceSha256": { "type": "string", "pattern": "^[0-9a-f]{64}$" },
            "outputClaimEvidenceSha256": { "type": "string", "pattern": "^[0-9a-f]{64}$" },
            "settlementEvidenceSha256": { "type": ["string", "null"], "pattern": "^[0-9a-f]{64}$" },
            "selectedCapabilities": {
              "type": "array",
              "minItems": 1,
              "maxItems": 32,
              "items": {
                "type": "object",
                "properties": {
                  "kind": { "enum": ["runtime", "runner", "role", "tool", "provider"] },
                  "key": { "type": "string", "minLength": 1, "maxLength": 100 },
                  "evidenceSha256": { "type": "string", "pattern": "^[0-9a-f]{64}$" }
                },
                "required": ["kind", "key", "evidenceSha256"],
                "additionalProperties": false,
                "maxProperties": 16
              }
            }
          },
          "required": ["checkedAt", "authorityEvidenceSha256", "resourceEvidenceSha256", "outputClaimEvidenceSha256", "settlementEvidenceSha256", "selectedCapabilities"],
          "additionalProperties": false,
          "maxProperties": 16
        }
      },
      "required": [
        "pathsVerified",
        "rolesVerified",
        "evidence",
        "piVersion",
        "subagentsVersion"
      ],
      "additionalProperties": false,
      "maxProperties": 16
    },
    "tasks": {
      "type": "array",
      "items": {
        "type": "object",
        "properties": {
          "key": {
            "type": "string",
            "pattern": "^[a-z][a-z0-9-]*$",
            "maxLength": 40,
            "minLength": 1
          },
          "text": {
            "type": "string",
            "minLength": 1,
            "maxLength": 8192
          },
          "lane": {
            "enum": [
              "local",
              "web"
            ]
          }
        },
        "required": [
          "key",
          "text",
          "lane"
        ],
        "additionalProperties": false,
        "maxProperties": 16
      },
      "minItems": 1,
      "maxItems": 4
    },
    "evidence": {
      "type": "array",
      "items": {
        "type": "object",
        "properties": {
          "label": {
            "type": "string",
            "minLength": 1,
            "maxLength": 100
          },
          "text": {
            "type": "string",
            "minLength": 1,
            "maxLength": 8192
          }
        },
        "required": [
          "label",
          "text"
        ],
        "additionalProperties": false,
        "maxProperties": 16
      },
      "minItems": 1,
      "maxItems": 8
    },
    "roles": {
      "type": "object",
      "properties": {
        "local": {
          "enum": [
            "patronus-researcher-pi"
          ]
        },
        "web": {
          "enum": [
            "patronus-web-researcher-pi"
          ]
        },
        "spec": {
          "enum": [
            "patronus-spec-author-pi"
          ]
        },
        "plan": {
          "enum": [
            "patronus-plan-author-pi"
          ]
        },
        "review": {
          "enum": [
            "patronus-plan-reviewer-pi"
          ]
        },
        "security": {
          "enum": [
            "patronus-workflow-security-reviewer-pi"
          ]
        }
      },
      "additionalProperties": false,
      "maxProperties": 16
    },
    "runners": {
      "type": "object",
      "properties": {
        "native": {
          "type": "object",
          "properties": {
            "status": {
              "enum": [
                "available",
                "unverified",
                "unavailable"
              ]
            },
            "reason": {
              "type": "string",
              "minLength": 1,
              "maxLength": 1000
            },
            "executable": {
              "type": "string",
              "maxLength": 4096,
              "minLength": 1,
              "description": "Canonical observed executable, or nonempty UNAVAILABLE sentinel for an unavailable candidate."
            },
            "version": {
              "type": "string",
              "maxLength": 100,
              "minLength": 1,
              "description": "Observed qualified version, or nonempty UNAVAILABLE sentinel for unavailable candidate."
            },
            "checkedAt": {
              "type": "string",
              "minLength": 1,
              "maxLength": 100
            },
            "contractVerified": {
              "type": "boolean"
            },
            "authEvidence": {
              "type": "string",
              "maxLength": 2000,
              "minLength": 1,
              "description": "Existing nonsecret version-qualified evidence when available; exactly UNVERIFIED for unverified auth, never an empty string."
            },
            "allowUnverified": {
              "type": "boolean"
            }
          },
          "required": [
            "status",
            "reason",
            "executable",
            "version",
            "checkedAt",
            "contractVerified",
            "authEvidence",
            "allowUnverified"
          ],
          "additionalProperties": false,
          "maxProperties": 16,
          "allOf": [
            {
              "if": {
                "properties": {
                  "status": {
                    "const": "unverified"
                  }
                }
              },
              "then": {
                "properties": {
                  "authEvidence": {
                    "const": "UNVERIFIED"
                  }
                }
              }
            },
            {
              "if": {
                "properties": {
                  "status": {
                    "const": "available"
                  }
                }
              },
              "then": {
                "properties": {
                  "authEvidence": {
                    "not": {
                      "enum": [
                        "UNVERIFIED",
                        "UNAVAILABLE"
                      ]
                    }
                  }
                }
              }
            }
          ]
        }
      },
      "required": [
        "native"
      ],
      "additionalProperties": false,
      "maxProperties": 16
    },
    "concurrency": {
      "type": "integer",
      "minimum": 1,
      "maximum": 2
    },
    "spawnLimit": {
      "type": "integer",
      "minimum": 1,
      "maximum": 12
    },
    "timeoutMs": {
      "type": "integer",
      "minimum": 1,
      "maximum": 3600000
    },
    "reconcile": {
      "type": "boolean"
    }
  },
  "required": [
    "cwd",
    "outputDir",
    "sourceRevision",
    "sourceRoots",
    "authorization",
    "preflight",
    "tasks",
    "evidence",
    "roles",
    "runners",
    "concurrency",
    "spawnLimit",
    "timeoutMs",
    "reconcile"
  ],
  "additionalProperties": false,
  "maxProperties": 16,
  "allOf": [
    {
      "if": { "required": ["mode"] },
      "then": {
        "properties": {
          "preflight": { "required": ["snapshotUse", "liveChecks"] }
        }
      },
      "else": {
        "properties": {
          "preflight": {
            "not": {
              "anyOf": [
                { "required": ["snapshotUse"] },
                { "required": ["liveChecks"] }
              ]
            }
          }
        }
      }
    },
    {
      "if": { "properties": { "mode": { "const": "research-only" } }, "required": ["mode"] },
      "then": {
        "properties": {
          "reconcile": { "const": false },
          "authorization": {
            "properties": {
              "actions": {
                "minItems": 1,
                "maxItems": 1,
                "prefixItems": [{ "const": "research" }]
              }
            }
          },
          "roles": {
            "propertyNames": { "enum": ["local", "web"] },
            "minProperties": 1,
            "maxProperties": 2
          }
        },
        "allOf": [
          {
            "if": { "properties": { "tasks": { "contains": { "properties": { "lane": { "const": "local" } }, "required": ["lane"] } } } },
            "then": { "properties": { "roles": { "required": ["local"] } } },
            "else": { "properties": { "roles": { "not": { "required": ["local"] } } } }
          },
          {
            "if": { "properties": { "tasks": { "contains": { "properties": { "lane": { "const": "web" } }, "required": ["lane"] } } } },
            "then": { "properties": { "roles": { "required": ["web"] } } },
            "else": { "properties": { "roles": { "not": { "required": ["web"] } } } }
          }
        ]
      },
      "else": {
        "properties": {
          "roles": { "required": ["local", "web", "spec", "plan", "review", "security"] }
        }
      }
    }
  ]
}
